
<!ELEMENT crimereport (incident)>
<!ELEMENT incident (date, time, address, type)
<!ELEMENT date (#PCDATA)>
<!ELEMENT time (#PCDATA)>
<!ELEMENT address (#PCDATA)>
<!ELEMENT crimetype (#PCDATA)>

<!ATTLIST crimetype type (ROBPER|THEFT|BIKE|ARSON|ASSAULT|FRAUD|CSC|MISPER)>
